Library	Description	Date / Version Supported
[ansis](https://github.com/webdiscus/ansis)	JavaScript library to colorize terminal with ANSI colors & styles	[2024-04-15 / 3.1.1](https://github.com/webdiscus/ansis/releases/tag/v3.1.1)
[chalk](https://github.com/chalk)	Color library for JavaScript	[2015-02-23 / 1.0.0](https://github.com/chalk/chalk/releases/tag/v1.0.0)
[supports-color](https://www.npmjs.com/package/supports-color)	JavaScript library to detect terminal color support	[2015-07-15 / 3.0.0](https://github.com/chalk/supports-color/releases/tag/3.0.0)
[colorette](https://www.npmjs.com/package/colorette)	JavaScript library to color text	[2018-07-13 / 1.0.0](https://github.com/jorgebucaran/colorette/releases/tag/1.0.0)
[rich](https://github.com/Textualize/rich)	Python library to display rich text	[2022-10-02 / 12.6.0](https://github.com/Textualize/rich/releases/tag/v12.6.0)
[termcolor](https://github.com/termcolor/termcolor)	Python library for ANSI color formatting in the terminal	[2022-10-30 / 2.1.0](https://github.com/termcolor/termcolor/releases/tag/2.1.0)
[Warna](https://github.com/komothecat/warna)	Terminal text styling library for Lua	[2024-02-11 / 0.1.0](https://github.com/komothecat/warna/releases/tag/v0.1.0-1)
